{
  "key": "test_type",
  "title": "Test configurable document type",
  "description": "A test configurable document on GOV.UK",
  "forms": {
    "documents": {
      "fields": {
        "body": {
          "title": "Body",
          "description": "The main content of the page",
          "block": "govspeak",
          "attribute_path": ["block_content", "body"],
          "translatable": true
        },
        "date_field": {
          "title": "Date Field",
          "description": "A date field for the page",
          "block": "default_date",
          "attribute_path": ["block_content", "date_field"],
          "translatable": true
        },
        "address": {
          "title": "Address",
          "description": "A nested object field",
          "block": "default_object",
          "attribute_path": [],
          "translatable": true,
          "fields": {
            "street": {
              "title": "Street",
              "description": "A default string inside the nested object",
              "block": "default_string",
              "attribute_path": ["block_content","street"],
              "translatable": true
            },
            "city": {
              "title": "City",
              "description": "Another default string inside the nested object",
              "block": "default_string",
              "attribute_path": ["block_content","city"],
              "translatable": true
            }
          }
        },
        "list_of_foods": {
          "title": "Food",
          "block": "default_array",
          "attribute_path": ["block_content", "list_of_foods"],
          "translatable": true,
          "fields": {
            "food": {
              "title": "Name of food item",
              "block": "default_string",
              "attribute_path": ["food"],
              "translatable": true
            }
          }
        },
        "nation_applicability": {
          "title": "Nation applicability",
          "description": "Which UK nations this content applies to",
          "block": "default_checkboxes",
          "attribute_path": ["block_content", "nation_applicability"],
          "translatable": false,
          "items": [
            {
              "label": "Applies to all UK nations",
              "value": "all"
            },
            {
              "label": "Does not apply to England",
              "value": "england",
              "conditionally_reveal": [
                {
                  "title": "URL of corresponding content",
                  "block": "default_string",
                  "attribute_path": ["alternative_url"],
                  "translatable": false
                }
              ]
            },
            {
              "label": "Does not apply to Scotland",
              "value": "scotland",
              "conditionally_reveal": [
                {
                  "title": "URL of corresponding content",
                  "block": "default_string",
                  "attribute_path": ["alternative_url"],
                  "translatable": false
                }
              ]
            },
            {
              "label": "Does not apply to Wales",
              "value": "wales",
              "conditionally_reveal": [
                {
                  "title": "URL of corresponding content",
                  "block": "default_string",
                  "attribute_path": ["alternative_url"],
                  "translatable": false
                }
              ]
            },
            {
              "label": "Does not apply to Northern Ireland",
              "value": "northern_ireland",
              "conditionally_reveal": [
                {
                  "title": "URL of corresponding content",
                  "block": "default_string",
                  "attribute_path": ["alternative_url"],
                  "translatable": false
                }
              ]
            }
          ]
        }
      }
    },
    "social_media_accounts": {
      "dynamic": true,
      "label": "Social media accounts",
      "fields": {
        "social_media_links": {
          "title": "Social media accounts",
          "block": "default_array",
          "attribute_path": ["block_content", "social_media_links"],
          "translatable": true,
          "fields": {
            "social_media_service_name": {
              "title": "Service",
              "block": "default_select",
              "attribute_path": ["social_media_service_name"],
              "blank_option_label": "No social media service selected",
              "translatable": true,
              "options": [
                {
                  "label": "X",
                  "value": "X"
                },
                {
                  "label": "Facebook",
                  "value": "Facebook"
                },
                {
                  "label": "YouTube",
                  "value": "YouTube"
                },
                {
                  "label": "Flickr",
                  "value": "Flickr"
                },
                {
                  "label": "Blog",
                  "value": "Blog"
                },
                {
                  "label": "Pinterest",
                  "value": "Pinterest"
                },
                {
                  "label": "LinkedIn",
                  "value": "LinkedIn"
                },
                {
                  "label": "Google Plus",
                  "value": "Google Plus"
                },
                {
                  "label": "Foursquare",
                  "value": "Foursquare"
                },
                {
                  "label": "Email",
                  "value": "Email"
                },
                {
                  "label": "Instagram",
                  "value": "Instagram"
                },
                {
                  "label": "Bluesky",
                  "value": "Bluesky"
                },
                {
                  "label": "Threads",
                  "value": "Threads"
                },
                {
                  "label": "Other",
                  "value": "Other"
                }
              ]
            },
            "url": {
              "title": "URL",
              "block": "default_string",
              "attribute_path": ["url"],
              "translatable": true
            },
            "title": {
              "title": "Title",
              "block": "default_string",
              "attribute_path": ["title"],
              "translatable": true
            }
          }
        }
      }
    }
  },
  "presenters": {
    "publishing_api": {
      "details": {
        "body": "govspeak",
        "date_field": "rfc3339_date",
        "list_of_foods": "raw",
        "national_applicability": "national_applicability"
      },
      "links": []
    }
  },
  "schema": {
    "attributes": {
      "body": {
        "type": "string"
      },
      "date_field": {
        "type": "date"
      },
      "street": {
        "type": "string"
      },
      "city": {
        "type": "string"
      },
      "list_of_foods": {
        "type": "array",
        "attributes": {
          "food": {
            "type": "string"
          }
        }
      },
      "social_media_links": {
        "type": "array",
        "attributes": {
          "social_media_service_name": {
            "type": "string"
          },
          "url": {
            "type": "string"
          },
          "title": {
            "type": "string"
          }
        }
      },
      "nation_applicability": {
        "type": "object"
      }
    },
    "validations": {
      "nation_applicability": {
        "attributes": ["nation_applicability"]
      }
    }
  },
  "settings": {
    "base_path_prefix": "/government/test-type",
    "publishing_api_schema_name": "news_article",
    "publishing_api_document_type": "news_story",
    "rendering_app": "frontend",
    "organisations": null,
    "backdating_enabled": false,
    "taxon": {
      "enabled": false,
      "required": false
    },
    "translations_enabled": true,
    "file_attachments_enabled": true,
    "features_enabled": true,
    "history_mode_enabled": true,
    "send_change_history": true,
    "allowed_child_document_types": [
      {
        "document_type": "test_type"
      }
    ],
    "images": {
      "enabled": true,
      "usages": {
        "lead": {
          "kinds": ["default"],
          "multiple": false,
          "caption_enabled": true
        },
        "govspeak_embed": {
          "label": "embeddable",
          "kinds": ["default"],
          "multiple": true,
          "caption_enabled": true
        },
        "header": {
          "label": "header",
          "kinds": ["topical_event_header"],
          "multiple": false,
          "caption_enabled": false
        }
      }
    }
  }
}
